{
  "format": "riglab.baked",
  "version": 1,
  "rig": "chibi",
  "animation": "unarmed-attack",
  "fps": 60,
  "loop": false,
  "bones": [
    "pelvis",
    "leg-front",
    "shin-front",
    "leg-back",
    "shin-back",
    "torso",
    "arm-front",
    "forearm-front",
    "arm-back",
    "forearm-back",
    "head"
  ],
  "frames": [
    [
      [
        0,
        -25,
        0
      ],
      [
        5,
        -25,
        0
      ],
      [
        5,
        -13,
        0
      ],
      [
        -5,
        -25,
        0
      ],
      [
        -5,
        -13,
        0
      ],
      [
        0,
        -29,
        0
      ],
      [
        9,
        -45,
        0
      ],
      [
        9,
        -35,
        0
      ],
      [
        -9,
        -45,
        0
      ],
      [
        -9,
        -35,
        0
      ],
      [
        0,
        -47,
        0
      ]
    ],
    [
      [
        -0.15625,
        -24.882812,
        0
      ],
      [
        4.84375,
        -24.882812,
        -0.78125
      ],
      [
        5.00737,
        -12.883928,
        0.15625
      ],
      [
        -5.15625,
        -24.882812,
        -4.431367
      ],
      [
        -4.229072,
        -12.918685,
        3.393479
      ],
      [
        -0.15625,
        -28.882812,
        -0.9375
      ],
      [
        8.580758,
        -45.027926,
        -6.40625
      ],
      [
        9.696531,
        -35.090369,
        -9.53125
      ],
      [
        -9.416833,
        -44.733415,
        0.625
      ],
      [
        -9.525914,
        -34.73401,
        0.625
      ],
      [
        -0.450761,
        -46.880403,
        -0.625
      ]
    ],
    [
      [
        -0.3125,
        -24.765625,
        0
      ],
      [
        4.6875,
        -24.765625,
        -1.5625
      ],
      [
        5.014709,
        -12.770087,
        0.3125
      ],
      [
        -5.3125,
        -24.765625,
        -8.862735
      ],
      [
        -3.463687,
        -12.908902,
        6.786958
      ],
      [
        -0.3125,
        -28.765625,
        -1.875
      ],
      [
        8.159176,
        -45.05153,
        -12.8125
      ],
      [
        10.376788,
        -35.30052,
        -19.0625
      ],
      [
        -9.831187,
        -44.462587,
        1.25
      ],
      [
        -10.049335,
        -34.464966,
        1.25
      ],
      [
        -0.901443,
        -46.755988,
        -1.25
      ]
    ],
    [
      [
        -0.65625,
        -24.507812,
        0
      ],
      [
        4.34375,
        -24.507812,
        -3.28125
      ],
      [
        5.030598,
        -12.527485,
        0.65625
      ],
      [
        -5.65625,
        -24.507812,
        -12.838113
      ],
      [
        -2.989885,
        -12.807791,
        8.872309
      ],
      [
        -0.65625,
        -28.507812,
        -3.9375
      ],
      [
        7.223814,
        -45.08806,
        -26.90625
      ],
      [
        11.749134,
        -36.170578,
        -40.03125
      ],
      [
        -10.733698,
        -43.852031,
        2.625
      ],
      [
        -11.191687,
        -33.862524,
        2.625
      ],
      [
        -1.892279,
        -46.465324,
        -2.625
      ]
    ],
    [
      [
        -1,
        -24.25,
        0
      ],
      [
        4,
        -24.25,
        -5
      ],
      [
        5.045869,
        -12.295664,
        1
      ],
      [
        -6,
        -24.25,
        -16.81349
      ],
      [
        -2.528914,
        -12.762983,
        10.95766
      ],
      [
        -1,
        -28.25,
        -6
      ],
      [
        6.278242,
        -45.103106,
        -41
      ],
      [
        12.838832,
        -37.556011,
        -61
      ],
      [
        -11.623152,
        -43.221594,
        4
      ],
      [
        -12.320717,
        -33.245954,
        4
      ],
      [
        -2.881512,
        -46.151394,
        -4
      ]
    ],
    [
      [
        -1.34375,
        -23.992187,
        0
      ],
      [
        3.65625,
        -23.992187,
        -6.71875
      ],
      [
        5.060199,
        -12.074599,
        1.34375
      ],
      [
        -6.34375,
        -23.992187,
        -19.750736
      ],
      [
        -2.288604,
        -12.698127,
        12.016575
      ],
      [
        -1.34375,
        -27.992187,
        -8.0625
      ],
      [
        5.323239,
        -45.096317,
        -55.09375
      ],
      [
        13.524134,
        -39.373964,
        -81.96875
      ],
      [
        -12.498843,
        -42.571759,
        5.375
      ],
      [
        -13.435582,
        -32.61573,
        5.375
      ],
      [
        -3.868308,
        -45.814269,
        -5.375
      ]
    ],
    [
      [
        -1.6875,
        -23.734375,
        0
      ],
      [
        3.3125,
        -23.734375,
        -8.4375
      ],
      [
        5.073266,
        -11.864257,
        1.6875
      ],
      [
        -6.6875,
        -23.734375,
        -22.687982
      ],
      [
        -2.05895,
        -12.662947,
        13.07549
      ],
      [
        -1.6875,
        -27.734375,
        -10.125
      ],
      [
        4.359599,
        -45.067367,
        -69.1875
      ],
      [
        13.70708,
        -41.514258,
        -102.9375
      ],
      [
        -13.36008,
        -41.903034,
        6.75
      ],
      [
        -14.535454,
        -31.972349,
        6.75
      ],
      [
        -4.851833,
        -45.454053,
        -6.75
      ]
    ],
    [
      [
        -1.84375,
        -23.617187,
        0
      ],
      [
        3.15625,
        -23.617187,
        -9.21875
      ],
      [
        5.078701,
        -11.772181,
        1.84375
      ],
      [
        -6.84375,
        -23.617187,
        -23.872368
      ],
      [
        -1.987343,
        -12.643797,
        13.395215
      ],
      [
        -1.84375,
        -27.617187,
        -11.0625
      ],
      [
        3.918941,
        -45.0468,
        -75.59375
      ],
      [
        13.604502,
        -42.558844,
        -112.46875
      ],
      [
        -13.746591,
        -41.592966,
        7.375
      ],
      [
        -15.03022,
        -31.675693,
        7.375
      ],
      [
        -5.297584,
        -45.28272,
        -7.375
      ]
    ],
    [
      [
        -2,
        -23.5,
        0
      ],
      [
        3,
        -23.5,
        -10
      ],
      [
        5.083778,
        -11.682307,
        2
      ],
      [
        -7,
        -23.5,
        -25.056753
      ],
      [
        -1.917811,
        -12.629335,
        13.714941
      ],
      [
        -2,
        -27.5,
        -12
      ],
      [
        3.476741,
        -45.021567,
        -82
      ],
      [
        13.379422,
        -43.629836,
        -122
      ],
      [
        -14.129915,
        -41.279156,
        8
      ],
      [
        -15.521646,
        -31.376476,
        8
      ],
      [
        -5.74241,
        -45.106657,
        -8
      ]
    ],
    [
      [
        -1.453125,
        -23.382812,
        0
      ],
      [
        3.546875,
        -23.382812,
        -7.03125
      ],
      [
        5.015803,
        -11.473058,
        4.34375
      ],
      [
        -6.453125,
        -23.382812,
        -24.779541
      ],
      [
        -1.42359,
        -12.487686,
        15.981039
      ],
      [
        -1.453125,
        -27.382812,
        -9.96875
      ],
      [
        4.641219,
        -44.699249,
        -67.859375
      ],
      [
        13.903836,
        -40.930438,
        -105.046875
      ],
      [
        -13.087022,
        -41.58325,
        6.515625
      ],
      [
        -14.221764,
        -31.647841,
        4.953125
      ],
      [
        -4.569123,
        -45.111054,
        -6.75
      ]
    ],
    [
      [
        -0.90625,
        -23.265625,
        0
      ],
      [
        4.09375,
        -23.265625,
        -4.0625
      ],
      [
        4.943885,
        -11.295777,
        6.6875
      ],
      [
        -5.90625,
        -23.265625,
        -24.502329
      ],
      [
        -0.929487,
        -12.346292,
        18.247137
      ],
      [
        -0.90625,
        -27.265625,
        -7.9375
      ],
      [
        5.798039,
        -44.355169,
        -53.71875
      ],
      [
        13.859259,
        -38.437675,
        -88.09375
      ],
      [
        -12.029509,
        -41.869498,
        5.03125
      ],
      [
        -12.906499,
        -31.908028,
        1.90625
      ],
      [
        -3.39192,
        -45.093172,
        -5.5
      ]
    ],
    [
      [
        0.296875,
        -23.007812,
        0
      ],
      [
        5.296875,
        -23.007812,
        2.46875
      ],
      [
        4.779981,
        -11.01895,
        11.84375
      ],
      [
        -4.703125,
        -23.007812,
        -23.001342
      ],
      [
        -0.014093,
        -11.961864,
        22.61419
      ],
      [
        0.296875,
        -27.007812,
        -3.46875
      ],
      [
        8.31232,
        -43.523037,
        -22.609375
      ],
      [
        12.156784,
        -34.291564,
        -50.796875
      ],
      [
        -9.654703,
        -42.433962,
        1.765625
      ],
      [
        -9.962814,
        -32.43871,
        -4.796875
      ],
      [
        -0.792199,
        -44.974836,
        -2.75
      ]
    ],
    [
      [
        1.5,
        -22.75,
        0
      ],
      [
        6.5,
        -22.75,
        9
      ],
      [
        4.622786,
        -10.89774,
        17
      ],
      [
        -3.5,
        -22.75,
        -21.500355
      ],
      [
        0.898084,
        -11.585016,
        26.981242
      ],
      [
        1.5,
        -26.75,
        1
      ],
      [
        10.777868,
        -42.590491,
        8.5
      ],
      [
        9.299774,
        -32.700333,